,title,text
846,僧正偏昭_847,"ふかくさのみかどの御時に、蔵人頭にてよるひるな   
れつかうまつりけるを、諒闇になりにければ、さらに世にもまじらずしてひえの山にの   
ぼりてかしらおろしてけり、その又のとし、みなひと御ぶくぬぎて、あるはかうぶりた   
まはりなどよろこびけるをききてよめる"
847,近院右のおほいまうちぎみ_848,"河原のおほいまうちぎみの身まかりての秋、かの家   
のほとりをまかりけるに、もみぢのいろまだふかくもならざりけるを見てよみていれた   
りける"
848,つらゆき_849,"藤原たかつねの朝臣の身まかりての又のとしの夏、   
ほととぎすのなきけるをききてよめる"
849,きのもちゆき_850,"さくらをうゑてありけるに、やうやく花さきぬべき   
時に、かのうゑける人身まかりにければ、その花を見てよめる"
850,つらゆき_851,あるじ身まかりにける人の家の梅花を見てよめる
851,みはるのありすけ_853,"藤原のとしもとの朝臣の右近中将にてすみ侍りける   
ざうしの、身まかりてのち人もすまずなりにけるを、秋の夜ふけてものよりまうできけ   
るついでに見いれければ、もとありしせんざいもいとしげくあれたりけるを見て、はや   
くそこに侍りければむかしを思ひやりてよみける"
852,とものり_854,"これたかのみこの、ちちの侍りけむ時によめりけむ   
うたどもとこひければ、かきておくりけるおくによみてかけりける"
853,よみ人しらず_855,"題しらず
なき人のやどにかよはば郭公かけてねにのみなくとつげなむ"
854,_856,誰見よと花さけるらむ白雲のたつのとはやくなりにし物を
855,_857,"式部卿のみこ閑院の五のみこにすみわたりけるを、   
いくばくもあらで女みこの身まかりにける時に、かのみこすみける帳のかたびらのひも   
にふみをゆひつけたりけるをとりて見れば、むかしのてにてこのうたをなむかきつけた   
りける"
856,よみ人しらず_858,"をとこの人のくににまかれりけるまに、女にはかに   
やまひをして、いとよわくなりにける時よみおきて身まかりにける"
857,大江千里_859,"やまひにわづらひ侍りける秋、心地のたのもしげな   
くおぼえければよみて人のもとにつかはしける"
858,藤原これもと_860,"身まかりなむとてよめる
つゆをなどあだなる物と思ひけむわが身も草におかぬばかりを"
859,なりひらの朝臣_861,"やまひしてよわくなりにける時よめる
つひにゆくみちとはかねてききしかどきのふけふとはおもはざりしを"
860,在原しげはる_862,"かひのくににあひしりて侍りける人とぶらはむとて   
まかりけるを、みち中にてにはかにやまひをして、いまいまとなりにければ、よみて京   
にもてまかりて母に見せよといひて、人につけ侍りけるうた"
861,よみ人しらず_863,"題しらず
わがうへに露ぞおくなるあまの河をわたる舟のかいのしづくか"
862,_864,思ふどちまとゐせる夜は唐錦たたまくをしき物にぞありける
863,_865,うれしきをなににつつまむ唐衣たもとゆたかにたてといはましを
864,_866,限なき君がためにとをる花はときしもわかぬ物にぞ有りける
865,_867,紫のひともとゆゑにむさしのの草はみながらあはれとぞ見る
866,なりひらの朝臣_868,"めのおとうとをもて侍りける人に、うへのきぬをお   
くるとてよみてやりける"
867,近院右のおほいまうちぎみ_869,"大納言ふぢはらのくにつねの朝臣の、宰相より中納   
言になりける時、そめぬうへのきぬあやをおくるとてよめる"
868,ふるのいまみち_870,"いそのかみのなむまつが宮づかへもせでいその神と   
いふ所にこもり侍りけるを、にはかにかうぶりたまはれりければ、よろこびいひつか   
はすとてよみてつかはしける"
869,なりひらの朝臣_871,"二条のきさきのまだ東宮のみやすんどころと申しけ   
る時に、おほはらのにまうでたまひける日よめる"
870,よしみねのむねさだ_872,"五節のまひひめを見てよめる
あまつかぜ雲のかよひぢ吹きとぢよをとめのすがたしばしとどめむ"
871,河原の左のおほいまうちぎみ_873,"五せちのあしたにかむざしのたまのおちたりけるを   
見て、たがならむととぶらひてよめる"
872,としゆきの朝臣_874,"寛平御時うへのさぶらひに侍りけるをのこども、か   
めをもたせてきさいの宮の御方におほみきのおろしときこえにたてまつりたりけるを、   
くら人どもわらひて、かめをおまへにもていでてともかくもいはずなりにければ、つか   
ひのかへりきて、さなむありつるといひければ、くら人のなかにおくりける"
873,けむげいほうし_875,"女どもの見てわらひければよめる
かたちこそみ山がくれのくち木なれ心は花になさばなりなむ"
874,きのとものり_876,"方たがへに人の家にまかれりける時に、あるじのき   
ぬをきせたりけるを、あしたにかへすとてよみける"
875,よみ人しらず_877,"題しらず
おそくいづる月にもあるかな葦引の山のあなたもをしむべらなり"
876,_878,わが心なぐさめかねつさらしなやをばすて山にてる月を見て
877,なりひらの朝臣_879,おほかたは月をもめでじこれぞこのつもれば人のおいとなるもの
878,きのつらゆき_880,"月おもしろしとて凡河内躬恒がまうできたりけるに   
よめる"
879,_881,"池に月の見えけるをよめる
ふたつなき物と思ひしをみなそこに山のはならでいづる月かげ"
880,よみ人しらず_882,"題しらず
あまの河雲のみをにてはやければひかりとどめず月ぞながるる"
881,_883,あかずして月のかくるる山本はあなたおもてぞこひしかりける
882,なりひらの朝臣_884,"これたかのみこのかりしけるともにまかりて、やど   
りにかへりて夜ひとよさけをのみ、物がたりをしけるに、十一日の月もかくれなむとし   
けるをりに、みこゑひてうちへいりなむとしければよみ侍りける"
883,あま敬信_885,"田むらのみかどの御時に、斎院に侍りけるあきらけ   
いこのみこを、ははあやまちありといひて斎院をかへられむとしけるを、そのことやみ   
にければよめる"
884,よみ人しらず_886,"題しらず
いその神ふるからをののもとかしは本の心はわすられなくに"
885,_887,いにしへの野中のし水ぬるけれど本の心をしる人ぞくむ
886,_888,いにしへのしづのをだまきいやしきもよきもさかりは有りし物なり
887,_889,今こそあれ我も昔はをとこ山さかゆく時も有りこしものを
888,_890,世中にふりぬる物はつのくにのながらのはしと我となりけり
889,_891,ささのはにふりつむ雪のうれをおもみ本くだちゆくわがさかりはも
890,_892,おほあらきのもりのした草おいぬれば駒もすさめずかる人もなし
891,_893,かぞふればとまらぬ物を年といひてことしはいたくおいぞしにける
892,_894,おしてるやなにはの水にやくしほのからくも我はおいにけるかな
893,_895,おいらくのこむとしりせばかどさしてなしとこたへてあはざらましを
894,_896,さかさまに年もゆかなむとりもあへずすぐるよはひやともにかへると
895,_897,とりとむる物にしあらねば年月をあはれあなうとすぐしつるかな
896,_898,"とどめあへずむべもとしとはいはれけりしかもつれなくすぐるよはひ   
か"
897,_899,鏡山いざ立ちよりて見てゆかむ年へぬる身はおいやしぬると
898,_900,"業平朝臣のははのみこ長岡にすみ侍りける時に、な   
りひら宮づかへすとて、時時もえまかりとぶらはず侍りければ、しはすばかりにははの   
みこのもとより、とみの事とてふみをもてまうできたり、あけて見ればことばはなくて   
ありけるうた"
899,なりひらの朝臣_901,"返し
世中にさらぬ別のなくもがな千世もとなげく人のこのため"
900,在原むねやな_902,"寛平御時きさいの宮の哥合のうた
白雪のやへふりしけるかへる山かへるがへるもおいにけるかな"
901,としゆきの朝臣_903,"おなじ御時のうへのさぶらひにてをのこどもにおほ   
みきたまひて、おほみあそびありけるついでにつかうまつれる"
902,よみ人しらず_904,"題しらず
ちはやぶる宇治の橋守なれをしぞあはれとは思ふ年のへぬれば"
903,_905,我見てもひさしく成りぬ住の江の岸の姫松いくよへぬらむ
904,_906,住吉の岸のひめ松人ならばいく世かへしととはましものを
905,_907,梓弓いそべのこ松たが世にかよろづ世かねてたねをまきけむ
906,_908,かくしつつ世をやつくさむ高砂のをのへにたてる松ならなくに
907,藤原おきかぜ_909,誰をかもしる人にせむ高砂の松も昔の友ならなくに
908,よみ人しらず_910,わたつ海のおきつしほあひにうかぶあわのきえぬ物からよる方もなし
909,_911,わたつ海のかざしにさせる白砂の浪もてゆへる淡路しま山
910,_912,わたの原よせくる浪のしばしばも見まくのほしき玉津島かも
911,_913,なにはがたしほみちくらしあま衣たみのの島にたづなき渡る
912,藤原ただふさ_914,"貫之がいづみのくにに侍りける時に、やまとよりこ   
えまうできてよみてつかはしける"
913,つらゆき_915,"返し
おきつ浪たかしのはまの浜松の名にこそ君をまちわたりつれ"
914,_916,"なにはにまかれりける時よめる
なにはがたおふるたまもをかりそめのあまとぞ我はなりぬべらなる"
915,みぶのただみね_917,"あひしれりける人の住吉にまうでけるによみてつか   
はしける"
916,つらゆき_918,"なにはへまかりける時、たみののしまにて雨にあひ   
てよめる"
917,_919,"法皇にし河おはしましたりける日、つるすにたてり   
といふことを題にてよませたまひける"
918,伊勢_920,"中務のみこの家の池に舟をつくりておろしはじめて   
あそびける日、法皇御覧じにおはしましたりけり、ゆふさりつかたかへりおはしまさむ   
としけるをりによみてたてまつりける"
919,真せいほうし_921,"からことといふ所にてよめる
宮こまでひびきかよへるからことは浪のをすげて風ぞひきける"
920,在原行平朝臣_922,"ぬのびきのたきにてよめる
こきちらす滝の白玉ひろひおきて世のうき時の涙にぞかる"
921,なりひらの朝諏_923,"布引の滝の本にて人人あつまりて哥よみける時によ   
める"
922,承均法師_924,"よしののたきを見てよめる
たがためにひきてさらせるぬのなれや世をへて見れどとる人もなき"
923,神たい法し_925,"題しらず
きよたきのせぜのしらいとくりためて山わけ衣おりてきましを"
924,伊勢_926,"竜門にまうでてたきのもとにてよめる
たちぬはぬきぬきし人もなき物をなに山姫のぬのさらすらむ"
925,たちばなのながもり_927,"朱雀院のみかどぬのびきのたき御覧ぜむとてふん月   
のなぬかの日あはしましてありける時に、さぶらふ人人に哥よませたまひけるによめる"
926,ただみね_928,"ひえの山なるおとはのたきを見てよめる
おちたぎつたきのみなかみとしつもりおいにけらしなくろきすぢなし"
927,みつね_929,"おなじたきをよめる
風ふけど所もさらぬ白雲はよをへておつる水にぞ有りける"
928,三条の町_930,"田むらの御時に女房のさぶらひにて御屏風のゑ御覧   
じけるに、たきおちたりける所おもしろし、これを題にてうたよめとさぶらふ人におほ   
せられければよめる"
929,つらゆき_931,"屏風のゑなる花をよめる
さきそめし時よりのちはうちはへて世は春なれや色のつねなる"
930,坂上これのり_932,"屏風のゑによみあはせてかきける
かりてほす山田のいねのきたれてなきこそわたれ秋のうければ"
931,読人しらず_933,"題しらず
世中はなにかつねなるあすかがはきのふのふちぞけふはせになる"
932,_934,いく世しもあらじわが身をなぞもかくあまのかるもに思ひみだるる
933,_935,雁のくる峯の朝霧はれずのみ思ひつきせぬ世中のうさ
934,小野たかむらの朝臣_936,しかりとてそむかれなくに事しあればまづなげかれぬあなう世中
935,をののさだき_937,"かひのかみに侍りける時、京へまかりのぼりける人   
につかはしける"
936,小野小町_938,"文屋のやすひでみかはのぞうになりて、あがた見に   
はえいでたたじやといひやれりける返事によめる"
937,_939,"題しらず
あはれてふ事こそうたて世中を思ひはなれぬほだしなりけれ"
938,よみ人しらず_940,あはれてふ事のはごとにおくつゆは昔をこふる涙なりけり
939,_941,世中のうきもつらきもつげなくにまづしる物はなみだなりけり
940,_942,世中は夢かうつつかうつつとも夢ともしらず有りてなければ
941,_943,"よのなかにいづらわが身のありてなしあはれとやいはむあなうとやい   
はむ"
942,_944,山里は物の惨慄き事こそあれ世のうきよりはすみよかりけり
943,これたかのみこ_945,白雲のたえずたなびく岑にだにすめばすみぬる世にこそ有りけれ
944,ふるのいまみち_946,しりにけむききてもいとへ世中は浪のさわぎに風ぞしくめる
945,そせい_947,いづこにか世をばいとはむ心こそのにも山にもまどふべらなれ
946,よみ人しらず_948,世中は昔よりやはうかりけむわが身ひとつのためになれるか
947,_949,世中をいとふ山べの草木とやあなうの花の色にいでにけむ
948,_950,みよしのの山のあなたにやどもがな世のうき時のかくれがにせむ
949,_951,世にふればうさこそまされみよしののいはのかけみちふみならしてむ
950,_952,いかならむ巌の中にすまばかは世のうき事のきこえこざらむ
951,_953,葦引の山のまにまにかくれなむうき世中はあるかひもなし
952,_954,世中のうけくにあきぬ奥山のこのはにふれる雪やけなまし
953,もののべのよしな_955,"おなじもじなきうた
よのうきめ見えぬ山ぢへいらむにはおもふ人こそほだしなりけれ"
954,凡河内みつね_956,"山のほうしのもとへつかはしける
世をすてて山にいる人山にても猶うき時はいづちゆくらむ"
955,_957,"物思ひける時、いときなきこを見てよめる
今更になにおひいづらむ竹のこのうきふししげき世とはしらずや"
956,よみ人しらず_958,"題しらず
世にふれば事のはしげきくれ竹のうきふしごとに鶯ぞなく"
957,_959,木にもあらず草にもあらぬ竹のよのはしにわが身はなりぬべらなり
958,_960,わが身からうき世中となづけつつ人のためさへかなしかるらむ
959,たかむらの朝臣_961,"おきのくににながされて侍りける時によめる
思ひきやひなのわかれにおとろへてあまのなはたきいさりせむとは"
960,在原行平朝臣_962,"田むらの御時に、事にあたりてつのくにのすまとい   
ふ所にこもり侍りけるに、宮のうちに侍りける人につかはしける"
961,をののはるかぜ_963,"左近将監とけて侍りける時に、女のとぶらひにおこ   
せたりける返事によみてつかはしける"
962,平さだふん_964,"つかさとけて侍りける時よめる
うき世にはかどさせりとも見えなくになどかわが身のいでがてにする"
963,_965,有りはてぬいのちまつまのほどばかりうきことしげくおもはずもがな
964,みやぢのきよき_966,"みこの宮のたちはきに侍りけるを、宮づかへつかう   
まつらずとてとけて侍りける時によめる"
965,清原深養父_967,"時なりける人の、にはかに時なくなりてなげくを   
見て、みづからのなげきもなくよろこびもなきことを思ひてよめる"
966,伊勢_968,"かつらに侍りける時に、七条の中宮のとはせ給へり   
ける御返事にたてまつれりける"
967,なりひらの朝臣_969,"紀のとしさだが阿波のすけにまかりける時に、むま   
のはなむけせむとて、けふといひおくれりける時に、ここかしこにまかりありきて夜ふ   
くるまで見えざりければつかはしける"
968,_970,"惟喬のみこのもとにまかりかよひけるを、かしらお   
ろしてをのといふ所に侍りけるに、正月にとぶらはむとてまかりたりけるに、ひえの山   
のふもとなりければ雪いとふかかりけり、しひてかのむろにまかりいたりてをがみける   
に、つれづれとしていと物がなしくて、かへりまうできてよみておくりける"
969,_971,"深草のさとにすみ侍りて京へまうでくとて、そこな   
りける人によみておくりける"
970,よみ人しらず_972,"返し
野とならばうづらとなきて年はへむかりにだにやは君がこざらむ"
971,_973,"題しらず
我を君なにはの浦に有りしかばうきめをみつのあまとなりにき"
972,_974,"返し
なにはがたうらむべきまもおもほえずいづこを見つのあまとかはなる"
973,_975,今更にとふべき人もおもほえずやへむぐらしてかどさせりてへ
974,みつね_976,"ともだちのひさしうまうでこざりけるもとによみ   
てつかはしける"
975,_977,"人をとはでひさしうありけるをりにあひうらみけれ   
ばよめる"
976,_978,"むねをかのおほよりがこしよりまうできたりける時   
に、雪のふりけるを見て、おのがおもひはこのゆきのごとくなむつもれるといひけるを   
りによめる"
977,宗岳大頼_979,"返し
君をのみ思ひこしぢのしら山はいつかは雪のきゆる時ある"
978,きのつらゆき_980,"こしなりける人につかはしける
思ひやるこしの白山しらねどもひと夜も夢にこえぬよぞなき"
979,よみ人しらず_981,"題しらず
いざここにわが世はへなむ菅原や伏見の里のあれまくもをし"
980,_982,わがいほはみわの山もとこひしくはとぶらひきませすぎたてるかど
981,きせんほうし_983,わがいほは宮このたつみしかぞすむ世をうぢ山と人はいふなり
982,よみ人しらず_984,あれにけりあはれいくよのやどなれやすみけむ人のおとづれもせぬ
983,よしみねのむねさだ_985,"ならへまかりける時に、あれたる家に女の琴ひきけ   
るをききてよみていれたりける"
984,二条_986,"はつせにまうづる道に、ならの京にやどれりける時   
よめる"
985,よみ人しらず_987,"題しらず
世中はいづれかさしてわがならむ行きとまるをぞやどとさだむる"
986,_988,相坂の嵐のかぜはさむけれどゆくへしらねばわびつつぞぬる
987,_989,風のうへにありかさだめぬちりの身はゆくへもしらずなりぬべらなり
988,伊勢_990,"家をうりてよめる
あすかがはふちにもあらぬわがやどもせにかはりゆく物にぞ有りける"
989,きのとものり_991,"つくしに侍りける時にまかりかよひつつごうちける   
人のもとに、京にかへりまうできてつかはしける"
990,みちのく_992,"女ともだちと物がたりしてわかれてのちにつかはし   
ける"
991,ふぢはらのただふさ_993,"寛平御時にもろこしのはう官にめされて侍りける時   
に、東宮のさぶらひにてをのこどもさけたうべけるついでによみ侍りける"
992,よみ人しらず_994,"題しらず
風ふけばおきつ白浪たつた山よはにや君がひとりこゆらむ"
993,_995,たがみそぎゆふつけ鳥か唐衣たつたの山にをりはへてなく
994,_996,わすられむ時しのべとぞ浜千鳥ゆくへもしらぬあとをとどむる
995,文屋ありすゑ_997,"貞観御時、万葉集はいつばかりつくれるぞととはせ   
給ひければよみてたてまつりける"
996,大江千里_998,寛平御時哥たてまつりけるついでにたてまつりける
997,ふぢはらのかちおむ_999,ひとしれず思ふ心は春霞たちいでてきみがめにも見えなむ
998,伊勢_1000,"哥めしける時にたてまつるとてよみて、おくに   
かきつけてたてまつりける"
999,よみ人しらず_1001,"題しらず
あふことのまれなるいろにおもひそめわが身はつねにあまぐものはるる時なくふじのねのもえつつとはにおもへどもあふことかたしなにしかも人をうらみむわたつみのおきをふかめておもひてしおもひはいまはいたづらになりぬべらなりゆく水のたゆる時なくかくなわにおもひみだれてふるゆきの    けなばけぬべく    おもへども    えぶの身なればなほやまずおもひはふかしあしひきの山した水のこがくれてたぎつ心をたれにかもあひかたらはむいろにいでば人しりぬべみすみぞめのゆふべになればひとりゐてあはれあはれとなげきあまりせむすべなみににはにいでてたちやすらへばしろたへの衣のそでにおくつゆのけなばけぬべくおもへどもなほなげかれぬはるがすみよそにも人にあはむとおもへば"
1000,_1002,"ふるうたたてまつりし時のもくろくの、そのながう   
た"
1001,壬生忠岑_1003,"ふるうたにくはへてたてまつれるながうた
くれ竹の世世のふることなかりせばいかほのぬまのいかにして思ふ心をのばへましあはれむかしべありきてふ人まろこそはうれしけれ身はしもながらことのはをあまつそらまできこえあげすゑのよまでのあととなし今もおほせのくだれるはちりにつげとやちりの身につもれる事をとはるらむこれをおもへばけだもののくもにほえけむ心地してちぢのなさけもおもほえずひとつ心ぞほこらしきかくはあれどもてるひかりちかきまもりの身なりしをたれかは秋のくる方にあざむきいでてみかきよりとのへもる身のみかきもりをさをさしくもおもほえずここのかさねのなかにてはあらしの風もきかざりき今はの山しちかければ春は霞にたなびかれ夏はうつせみなきくらし秋は時雨に袖をかし冬はしもにぞせめらるるかかるわびしき身ながらにつもれるとしをしるせればいつつのむつになりにけりこれにそはれるわたくしのおいのかずさへやよければ身はいやしくて年たかきことのくるしさかくしつつながらのはしのながらへてなにはのうらにたつ浪の浪のしわにやおぼほれむさすがにいのちをしければこしのくになるしら山のかしらはしろくなりぬともおとはのたきのおとにきくおいずしなずのくすりがも君がやちよをわかえつつ見む"
1002,_1004,君が世にあふさか山のいはし水こがくれたりと思ひけるかな
1003,凡河内躬恒_1005,"冬のなかうた
ちはやぶら神な月とやけさよりはくもりもあへずはつ時雨紅葉とともにふるさとのよしのの山の山あらしもさむく日ごとになりゆけばたまのをとけてこきちらしあられみだれてしも氷いやかたまれるにはのおもにむらむら見ゆる冬草のうへにふりしく白雪のつもりつもりてあらたまのとしをあまたもすぐしつるかな"
1004,伊勢_1006,"七条のきさきうせたまひにけるのちによみける
おきつなみあれのみまさる宮のうちはとしへてすみしいせのあまも舟ながしたる心地してよらむ方なくかなしきに涙の色のくれなゐは我らがなかの時雨にて秋のもみぢと人人はおのがちりぢりわかれなばたのむかげなくなりはててとまる物とは花すすききみなき庭にむれたちてそらをまねかばはつかりのなき渡りつつよそにこそ見め"
1005,よみ人しらず_1007,"題しらず
うちわたすをち方人に物まうすわれそのそこにしろくさけるはなにの花ぞも"
1006,_1008,"返し
春さればのべにまづさく見れどあかぬ花まひなしにただなのるべき花のななれや"
